{
  "SPDX-License-Identifier": "AGPL-3.0-or-later",
  "capabilities": {
    "documentation_pages": [
      "docs/adr/0001-repository-scope-and-ownership-boundaries.md",
      "docs/adr/0002-multi-language-acceleration-and-dispatch.md",
      "docs/adr/0003-upstream-pending-carriers-and-prescribed-inputs.md",
      "docs/adr/0004-curated-public-api-facade.md",
      "docs/adr/0005-delivered-versus-roadmap-honesty.md",
      "docs/adr/0006-formal-verification-strategy.md",
      "docs/adr/0007-validation-and-benchmark-integrity.md",
      "docs/adr/0008-combinational-fast-veto-lane.md",
      "docs/adr/0009-standards-interop-seams.md",
      "docs/adr/0010-merge-window-predictor-feature-boundary.md",
      "docs/adr/index.md",
      "docs/api/aer/spike_buffer.md",
      "docs/api/daq/bus_mock.md",
      "docs/api/diagnostics/normalisation.md",
      "docs/api/diagnostics/stress_inject.md",
      "docs/api/ecosystem.md",
      "docs/api/evidence.md",
      "docs/api/formal/capacitor_bank.md",
      "docs/api/formal/faraday_recovery.md",
      "docs/api/formal/kinematic_safety.md",
      "docs/api/formal/plasmoid_merger_petri_net.md",
      "docs/api/formal/pulsed_shot.md",
      "docs/api/fpga/adc_to_spike_quantiser.md",
      "docs/api/fpga/timing_evidence_package.md",
      "docs/api/full_chain.md",
      "docs/api/index.md",
      "docs/api/interop/imas_mapping.md",
      "docs/api/interop/trigger_io.md",
      "docs/api/kinematic/doppler_kuramoto.md",
      "docs/api/kinematic/fire_time.md",
      "docs/api/kinematic/merge_window.md",
      "docs/api/kinematic/merge_window_features.md",
      "docs/api/kinematic/merge_window_predictor.md",
      "docs/api/kinematic/moving_frame_upde.md",
      "docs/api/kinematic/safety_certificate.md",
      "docs/api/kinematic/streaming_trigger.md",
      "docs/api/kinematic/trigger_probability.md",
      "docs/api/lifecycle/capacitor_bank.md",
      "docs/api/lifecycle/plasmoid_merger_petri_net.md",
      "docs/api/lifecycle/pulsed_shot_fsm.md",
      "docs/api/merge_trigger.md",
      "docs/api/physics/faraday_recovery.md",
      "docs/api/physics/fusion_frc_contract.md",
      "docs/api/physics/fusion_merge_window_replay.md",
      "docs/api/studio_manifest.md",
      "docs/api/studio_vertical.md",
      "docs/architecture/index.md",
      "docs/architecture/system_map.md",
      "docs/assets/README.md",
      "docs/generated/compatibility_matrix.md",
      "docs/guides/fusion_to_fire_full_chain.md",
      "docs/guides/getting_started.md",
      "docs/guides/quality_gates.md",
      "docs/index.md",
      "docs/papers/dysco.md",
      "docs/papers/index.md",
      "docs/papers/us12567738b1.md",
      "docs/reference/formal_property_catalogue.md",
      "docs/standards/safety_readiness_mapping.md",
      "docs/validation/belova_merge_reproduction.md",
      "docs/validation/benchmark_dashboard.md",
      "docs/validation/fair_validation_bundle.md"
    ],
    "go_parity_sources": [
      "go/cmd/daqmock_probe/main.go",
      "go/cmd/doccheck/main.go",
      "go/daqmock/doc.go",
      "go/daqmock/frame.go"
    ],
    "hdl_rtl_modules": [
      "hdl/src/aer/mif_aer_cdc_synchroniser.sv",
      "hdl/src/sensors/adc_to_spike_quantiser.sv",
      "hdl/src/triggers/mif_fast_veto_gate.sv",
      "hdl/src/triggers/mif_trigger_fabric.sv"
    ],
    "julia_reference_modules": [
      "julia/SCPNMIFCore/src/SCPNMIFCore.jl",
      "julia/SCPNMIFCore/src/aer_spike.jl",
      "julia/SCPNMIFCore/src/capacitor_bank.jl",
      "julia/SCPNMIFCore/src/diagnostic_normalisation.jl",
      "julia/SCPNMIFCore/src/diagnostic_stress_inject.jl",
      "julia/SCPNMIFCore/src/doppler_kuramoto.jl",
      "julia/SCPNMIFCore/src/kinematic_safety.jl",
      "julia/SCPNMIFCore/src/merge_window.jl",
      "julia/SCPNMIFCore/src/moving_frame_upde.jl"
    ],
    "lean_proof_modules": [
      "lean/SCPNMIF/Basic.lean",
      "lean/SCPNMIF/CapacitorBank.lean",
      "lean/SCPNMIF/FaradayRecovery.lean",
      "lean/SCPNMIF/Kinematic.lean",
      "lean/SCPNMIF/KinematicSafety.lean",
      "lean/SCPNMIF/PlasmoidMergerPetriNet.lean",
      "lean/SCPNMIF/PulsedShot.lean",
      "lean/SCPNMIF.lean"
    ],
    "python_classes": [
      {
        "name": "AERControlObservation",
        "path": "src/scpn_mif_core/aer/spike_buffer.py"
      },
      {
        "name": "AERDecodeSpec",
        "path": "src/scpn_mif_core/aer/spike_buffer.py"
      },
      {
        "name": "AERDecodedObservation",
        "path": "src/scpn_mif_core/aer/spike_buffer.py"
      },
      {
        "name": "AERSpikeEvent",
        "path": "src/scpn_mif_core/aer/spike_buffer.py"
      },
      {
        "name": "BankTelemetry",
        "path": "src/scpn_mif_core/lifecycle/pulsed_shot_fsm.py"
      },
      {
        "name": "CapacitorBank",
        "path": "src/scpn_mif_core/lifecycle/capacitor_bank.py"
      },
      {
        "name": "CapacitorBankSpec",
        "path": "src/scpn_mif_core/lifecycle/capacitor_bank.py"
      },
      {
        "name": "CapacitorBankState",
        "path": "src/scpn_mif_core/lifecycle/capacitor_bank.py"
      },
      {
        "name": "DataBusMock",
        "path": "src/scpn_mif_core/daq/bus_mock.py"
      },
      {
        "name": "DegradedSensorStream",
        "path": "src/scpn_mif_core/diagnostics/stress_inject.py"
      },
      {
        "name": "DescriptorProfile",
        "path": "src/scpn_mif_core/daq/bus_mock.py"
      },
      {
        "name": "DiagnosticChannelCalibration",
        "path": "src/scpn_mif_core/diagnostics/normalisation.py"
      },
      {
        "name": "DiagnosticFrame",
        "path": "src/scpn_mif_core/diagnostics/stress_inject.py"
      },
      {
        "name": "DiagnosticNormalisationState",
        "path": "src/scpn_mif_core/diagnostics/normalisation.py"
      },
      {
        "name": "DopplerKuramoto",
        "path": "src/scpn_mif_core/kinematic/doppler_kuramoto.py"
      },
      {
        "name": "DopplerKuramotoReport",
        "path": "src/scpn_mif_core/kinematic/doppler_kuramoto.py"
      },
      {
        "name": "DopplerKuramotoSpec",
        "path": "src/scpn_mif_core/kinematic/doppler_kuramoto.py"
      },
      {
        "name": "DopplerKuramotoState",
        "path": "src/scpn_mif_core/kinematic/doppler_kuramoto.py"
      },
      {
        "name": "DropoutSpec",
        "path": "src/scpn_mif_core/diagnostics/stress_inject.py"
      },
      {
        "name": "EnergyReport",
        "path": "src/scpn_mif_core/lifecycle/capacitor_bank.py"
      },
      {
        "name": "FaradayRecoveryReport",
        "path": "src/scpn_mif_core/physics/faraday_recovery.py"
      },
      {
        "name": "FaradayRecoverySpec",
        "path": "src/scpn_mif_core/physics/faraday_recovery.py"
      },
      {
        "name": "FaradayRecoveryState",
        "path": "src/scpn_mif_core/physics/faraday_recovery.py"
      },
      {
        "name": "FireTimeDecision",
        "path": "src/scpn_mif_core/kinematic/fire_time.py"
      },
      {
        "name": "FireTimePolicy",
        "path": "src/scpn_mif_core/kinematic/fire_time.py"
      },
      {
        "name": "FusionCompressionStroke",
        "path": "src/scpn_mif_core/physics/fusion_merge_window_replay.py"
      },
      {
        "name": "FusionFRCContractReport",
        "path": "src/scpn_mif_core/physics/fusion_frc_contract.py"
      },
      {
        "name": "FusionFRCSurface",
        "path": "src/scpn_mif_core/physics/fusion_frc_contract.py"
      },
      {
        "name": "FusionFRCSurfaceReport",
        "path": "src/scpn_mif_core/physics/fusion_frc_contract.py"
      },
      {
        "name": "FusionMergeWindowFixture",
        "path": "src/scpn_mif_core/physics/fusion_merge_window_replay.py"
      },
      {
        "name": "JitterSpec",
        "path": "src/scpn_mif_core/diagnostics/stress_inject.py"
      },
      {
        "name": "KinematicSafetyCertificate",
        "path": "src/scpn_mif_core/kinematic/safety_certificate.py"
      },
      {
        "name": "KinematicSafetySpec",
        "path": "src/scpn_mif_core/kinematic/safety_certificate.py"
      },
      {
        "name": "MeasurementNoiseSpec",
        "path": "src/scpn_mif_core/kinematic/trigger_probability.py"
      },
      {
        "name": "MergeWindowFeatureBoundaryError",
        "path": "src/scpn_mif_core/kinematic/merge_window_features.py"
      },
      {
        "name": "MergeWindowFeatureVector",
        "path": "src/scpn_mif_core/kinematic/merge_window_features.py"
      },
      {
        "name": "MergeWindowMonitor",
        "path": "src/scpn_mif_core/kinematic/merge_window.py"
      },
      {
        "name": "MergeWindowPrediction",
        "path": "src/scpn_mif_core/kinematic/merge_window_predictor.py"
      },
      {
        "name": "MergeWindowPredictorWeights",
        "path": "src/scpn_mif_core/kinematic/merge_window_predictor.py"
      },
      {
        "name": "MergeWindowSample",
        "path": "src/scpn_mif_core/kinematic/merge_window.py"
      },
      {
        "name": "MergeWindowSpec",
        "path": "src/scpn_mif_core/kinematic/merge_window.py"
      },
      {
        "name": "MergeWindowTrace",
        "path": "src/scpn_mif_core/kinematic/merge_window.py"
      },
      {
        "name": "MergerMarking",
        "path": "src/scpn_mif_core/lifecycle/plasmoid_merger_petri_net.py"
      },
      {
        "name": "MergerObservation",
        "path": "src/scpn_mif_core/lifecycle/plasmoid_merger_petri_net.py"
      },
      {
        "name": "MergerPlace",
        "path": "src/scpn_mif_core/lifecycle/plasmoid_merger_petri_net.py"
      },
      {
        "name": "MergerStep",
        "path": "src/scpn_mif_core/lifecycle/plasmoid_merger_petri_net.py"
      },
      {
        "name": "MergerTransition",
        "path": "src/scpn_mif_core/lifecycle/plasmoid_merger_petri_net.py"
      },
      {
        "name": "MergerTransitionRecord",
        "path": "src/scpn_mif_core/lifecycle/plasmoid_merger_petri_net.py"